{
  "name": "enterprise_20n",
  "description": "20-node enterprise network — primary demo topology with DMZ, internal LAN, and cloud resources",
  "nodes": [
    {"node_id": "internet_gw",      "node_type": "router",      "software": "Cisco IOS",     "version": "15.7",   "is_entry_point": true,  "is_critical_asset": false, "description": "Internet gateway router"},
    {"node_id": "dmz_firewall",     "node_type": "firewall",    "software": "Palo Alto",     "version": "9.1.3",  "is_entry_point": false, "is_critical_asset": false, "description": "DMZ perimeter firewall"},
    {"node_id": "web_server_1",     "node_type": "server",      "software": "Nginx",         "version": "1.18.0", "is_entry_point": true,  "is_critical_asset": false, "description": "Customer-facing web server 1"},
    {"node_id": "web_server_2",     "node_type": "server",      "software": "Apache",        "version": "2.4.49", "is_entry_point": true,  "is_critical_asset": false, "description": "Customer-facing web server 2 (legacy)"},
    {"node_id": "mail_server",      "node_type": "server",      "software": "Postfix",       "version": "3.5.0",  "is_entry_point": true,  "is_critical_asset": false, "description": "Mail server — phishing entry"},
    {"node_id": "internal_fw",      "node_type": "firewall",    "software": "pfSense",       "version": "2.5.2",  "is_entry_point": false, "is_critical_asset": false, "description": "Internal network firewall"},
    {"node_id": "vpn_gateway",      "node_type": "server",      "software": "OpenVPN",       "version": "2.4.7",  "is_entry_point": true,  "is_critical_asset": false, "description": "Remote access VPN gateway"},
    {"node_id": "sarah_laptop",     "node_type": "workstation", "software": "VpnClient",     "version": "2.1",    "is_entry_point": false, "is_critical_asset": false, "description": "Sarah's laptop with old VPN client"},
    {"node_id": "dev_workstation",  "node_type": "workstation", "software": "Ubuntu",        "version": "22.04",  "is_entry_point": false, "is_critical_asset": false, "description": "Developer workstation"},
    {"node_id": "admin_pc",         "node_type": "workstation", "software": "Windows",       "version": "11",     "is_entry_point": false, "is_critical_asset": false, "description": "IT admin workstation"},
    {"node_id": "dev_server",       "node_type": "server",      "software": "Jenkins",       "version": "2.289",  "is_entry_point": false, "is_critical_asset": false, "description": "CI/CD build server"},
    {"node_id": "app_server",       "node_type": "server",      "software": "Tomcat",        "version": "9.0.41", "is_entry_point": false, "is_critical_asset": false, "description": "Internal application server"},
    {"node_id": "ldap_server",      "node_type": "server",      "software": "OpenLDAP",      "version": "2.4.57", "is_entry_point": false, "is_critical_asset": false, "description": "Authentication & LDAP server"},
    {"node_id": "monitoring",       "node_type": "server",      "software": "Prometheus",    "version": "2.30.0", "is_entry_point": false, "is_critical_asset": false, "description": "Monitoring server"},
    {"node_id": "customer_db",      "node_type": "database",    "software": "PostgreSQL",    "version": "13.4",   "is_entry_point": false, "is_critical_asset": true,  "description": "Primary customer database — TARGET"},
    {"node_id": "analytics_db",     "node_type": "database",    "software": "MySQL",         "version": "8.0.26", "is_entry_point": false, "is_critical_asset": false, "description": "Analytics data warehouse"},
    {"node_id": "cloud_storage",    "node_type": "cloud",       "software": "AWS S3",        "version": "latest", "is_entry_point": false, "is_critical_asset": true,  "description": "Cloud storage — sensitive backups"},
    {"node_id": "cloud_compute",    "node_type": "cloud",       "software": "AWS EC2",       "version": "latest", "is_entry_point": false, "is_critical_asset": false, "description": "Cloud compute instances"},
    {"node_id": "backup_server",    "node_type": "server",      "software": "Rsync",         "version": "3.2.3",  "is_entry_point": false, "is_critical_asset": false, "description": "On-prem backup server"},
    {"node_id": "file_server",      "node_type": "server",      "software": "Samba",         "version": "4.13.0", "is_entry_point": false, "is_critical_asset": false, "description": "Internal file sharing server"}
  ],
  "edges": [
    {"source": "internet_gw",     "target": "dmz_firewall",    "connection_type": "http",  "has_firewall": true,  "permission_level": "read"},
    {"source": "dmz_firewall",    "target": "web_server_1",    "connection_type": "http",  "has_firewall": true,  "permission_level": "read"},
    {"source": "dmz_firewall",    "target": "web_server_2",    "connection_type": "http",  "has_firewall": true,  "permission_level": "read"},
    {"source": "dmz_firewall",    "target": "mail_server",     "connection_type": "http",  "has_firewall": true,  "permission_level": "read"},
    {"source": "internet_gw",     "target": "vpn_gateway",     "connection_type": "vpn",   "has_firewall": true,  "permission_level": "write"},
    {"source": "vpn_gateway",     "target": "sarah_laptop",    "connection_type": "vpn",   "has_firewall": false, "permission_level": "write"},
    {"source": "web_server_1",    "target": "internal_fw",     "connection_type": "http",  "has_firewall": true,  "permission_level": "read"},
    {"source": "web_server_2",    "target": "internal_fw",     "connection_type": "http",  "has_firewall": true,  "permission_level": "read"},
    {"source": "mail_server",     "target": "internal_fw",     "connection_type": "http",  "has_firewall": true,  "permission_level": "read"},
    {"source": "internal_fw",     "target": "app_server",      "connection_type": "http",  "has_firewall": false, "permission_level": "write"},
    {"source": "internal_fw",     "target": "ldap_server",     "connection_type": "http",  "has_firewall": false, "permission_level": "write"},
    {"source": "sarah_laptop",    "target": "dev_server",      "connection_type": "ssh",   "has_firewall": false, "permission_level": "admin"},
    {"source": "sarah_laptop",    "target": "file_server",     "connection_type": "ftp",   "has_firewall": false, "permission_level": "write"},
    {"source": "dev_workstation", "target": "dev_server",      "connection_type": "ssh",   "has_firewall": false, "permission_level": "admin"},
    {"source": "admin_pc",        "target": "ldap_server",     "connection_type": "rdp",   "has_firewall": false, "permission_level": "admin"},
    {"source": "admin_pc",        "target": "monitoring",      "connection_type": "http",  "has_firewall": false, "permission_level": "admin"},
    {"source": "dev_server",      "target": "app_server",      "connection_type": "http",  "has_firewall": false, "permission_level": "write"},
    {"source": "dev_server",      "target": "customer_db",     "connection_type": "sql",   "has_firewall": false, "permission_level": "admin"},
    {"source": "dev_server",      "target": "analytics_db",    "connection_type": "sql",   "has_firewall": false, "permission_level": "write"},
    {"source": "app_server",      "target": "customer_db",     "connection_type": "sql",   "has_firewall": false, "permission_level": "write"},
    {"source": "app_server",      "target": "ldap_server",     "connection_type": "http",  "has_firewall": false, "permission_level": "read"},
    {"source": "ldap_server",     "target": "customer_db",     "connection_type": "sql",   "has_firewall": false, "permission_level": "read"},
    {"source": "app_server",      "target": "cloud_storage",   "connection_type": "http",  "has_firewall": false, "permission_level": "write"},
    {"source": "app_server",      "target": "cloud_compute",   "connection_type": "http",  "has_firewall": false, "permission_level": "admin"},
    {"source": "customer_db",     "target": "backup_server",   "connection_type": "ssh",   "has_firewall": false, "permission_level": "write"},
    {"source": "customer_db",     "target": "cloud_storage",   "connection_type": "http",  "has_firewall": false, "permission_level": "write"},
    {"source": "file_server",     "target": "backup_server",   "connection_type": "ssh",   "has_firewall": false, "permission_level": "write"},
    {"source": "analytics_db",    "target": "cloud_storage",   "connection_type": "http",  "has_firewall": false, "permission_level": "write"},
    {"source": "monitoring",      "target": "dev_server",      "connection_type": "http",  "has_firewall": false, "permission_level": "read"},
    {"source": "monitoring",      "target": "app_server",      "connection_type": "http",  "has_firewall": false, "permission_level": "read"}
  ]
}
